"62","101247672116098_566052675635593","Facebook","2023-04-05 08:50:19","2023-04-11 14:27:02","photo","Як ҳафтаи ҷаҳон: Интиқоли яроқи ҳастаӣ ба Беларус ва мега-лоиҳаи “Толибон” Шарҳи рӯйдодҳои асосии ҳафтаи ахир дар арсаи байнулмилалӣ, ки барои Осиёи Марказӣ муҳиманд - аз даври нави бӯҳрон дар муносиботи Ғарб ва Русия, мушкили таҳримҳои дуюмдараҷа то лоиҳаҳои нави ҳукумати Толибон. Чӣ гуна орзуҳои президент Лукашенко ҷомаи амал мепӯшанд Ҳафтаи гузашта қазияи ҷойгиркунии силоҳи тактикии ҳастаӣ (ядроӣ) дар Беларус дар шакли як қатор изҳороти пурсарусадо, нашри матолиб дар ВАО ва баҳсҳои байналмилалӣ идома ёфт, ки муносибатҳои Русия ва “Ғарби дастаҷамъӣ”-ро бадтар кард. Тавре ки “Мавҷи Олмон” менависад, рӯзи 25 март Владимир Путин, президенти Русия алайҳи кишварҳои ғарбии пуштибони Украина бо иттиҳомоти нав изҳори назар карда, эълом дошт, ки дар фурсатҳои наздик дар Беларус яроқи тактикии ҳастаиашро ҷойгир мекунад. Ин тасмим дар саросаридунё вокуниши бузурге ба вуҷуд овард, зеро ҷойгиркунии аслиҳаи қатли ом дар қаламрави як давлати ғайриҳастаӣ дар тӯли 30 соли охир ва эҳтимолан ҳатто пас аз бӯҳрони ҳастаӣ дар ҳавзаи Кариб байни ИМА ва Иттиҳоди Шӯравӣ (СССР) собиқа надоштааст. Ҳафтаи равон президент Лукашенко зимни ироаи паём ба парлумон гуфт, ҳамеша орзу дошт, ки силоҳи ҳастаиро ба Беларус баргардонад (дар замони шӯравӣ дар Беларус силоҳи ҳастаии стратегӣ ва тактикӣ ҷойгир карда мешуд), аммо дар солҳои 90-ум, Лукашенкоро гӯё маҷбур кардаанд, ки аз он даст кашад. Аз суханронии ӯ чунин бармеояд, ки баъди ҷойгир кардани яроқи тактикии ҳастаӣ қоидаи «тугмаи дугона» ҷорӣ карда мешавад, яъне дар бораи истифодаи он дар Минск ва Москва якҷоя қарор кабул мекунанд. Ин бархилофи ваъдаи аввалаи Владимир Путин аст, ки мақомоти Беларус назорати аслиҳаи ҳастаии ба кишвар интиқолшударо нахоҳанд дошт. Дар ҷомеаи ҷаҳонӣ, пеш аз ҳама дар кишварҳои ғарбӣ, тасмими Русия ба таври ҷиддӣ қабул ва ба сифати як қадами муҳим ба сӯи даври нави шиддатёбии вазъият арзёбӣ шуд. Ба гузориши РБК, намояндагони Иттиҳоди Аврупо (ИА) ин тасмими Маскавро “талоши тарсондан” хонда, ба Русия барои “бемасъулиятона шиддат бахшидан ба вазъият” бо таҳримҳои нав (дар ҳоли ҳозир таҳия мешаванд) таҳдид карданд. Дар ҳамин ҳол, Департаменти давлатии ИМА изҳор дошт, ки дар бораи омодагии Русия ба зарбаи ҳастаӣ маълумот надорад. Бо вуҷуди ин, РБК инчунин ба суханони Доналд Трамп, собиқ президенти ИМА истинод мекунад, ки тибқи он, агар Маскав нақшаи интиқоли силоҳи ҳастаиро амалӣ кунад, амрикоиҳоро лозим меояд, ки “танҳо ба Худованд такя кунанд”. Силсилаи мусоҳибаҳо бо сиёсатшинос Юрий Филштинский дар интернет ва шабакаҳои иҷтимоии русзабон сару садоҳои зиёдеро ба бор овард, ки тибқи он Маскав гӯё мехоҳад дар аввали моҳи сентябр аз қаламрави Беларус ба Литва ва Лаҳистон зарбаи ҳастаӣ занад. Байни сиёсатшиносони маъруфи Кремл гуфтаҳои Сергей Макаров бо мантиқи аҷибе фарқ мекард, ки дар канали онлайни ОСН чунин изҳори назар кард: ""Инсоният бояд аз Путин барои ҷойгир кардани силоҳи ҳастаӣ дар Беларус миннатдор бошад"", зеро гӯё Русия барои нигоҳ доштани Ғарб ва умуман ҳама гуна унсурҳои бад як барномаи семоҳа дорад”. Ва ниҳоят, собиқ президент ва сарвазири Русия Дмитрий Медведев ҳамаро бо гуфтаҳои худ дар ин маврид хушнуд кард. Ба ақидаи ӯ, тавре “Московский комсомолец” менависад, эътирози мухолифони истиқрори силоҳи тактикии ҳастаӣ ҷуз “сафсатаҳои апокалиптикии хуконаи пайравони Бандера” чизи дигаре нест ва агар Ғарб дар посух ногаҳон тасмим бигирад, ки силоҳи ҳастаии худро дар Украина ҷойгир кунад, Маскав бояд ба Киев зарбаи огоҳкунандаи ҳастаӣ занад. Рӯзи 31 март Шӯрои Амнияти СММ, менависад сомонаи расмии ин созмон, ҷаласаи изтирорӣ баргузор кард, ки бо назардошти ""таҳдид ба сулҳу амнияти байналмилалӣ"", комилан ба истиқрори силоҳи ҳастаӣ дар қаламрави Беларус бахшида шуд. Дар ин ҷаласа аксари маърӯзачиён раҳбарияти Русияро муътақид сохтанӣ буданд, ки тасмимашро тағйир бидиҳад, вале ҳеҷ натиҷае ҳосил нашуд. Аммо нутқи намояндаи Чин хеле ғайричашмдошт буд. Ба гузориши хабаргузории Lenta.ru, вай гуфтааст, ки кишвараш комилан мухолифи интиқоли силоҳи ҳастаӣ ба кишварҳои дигар аст, яъне Пекин ошкоро аз мавзеъгирии Маскав ҳимоят накард. Ин гувоҳи он аст, ки тасмими Путин дар бораи истиқрори силоҳи ҳастаии тактикӣ дар Беларус бо Си Ҷинпин дар музокироти ахири Маскав мувофиқа нашудааст - гузашта аз ин, ин тасмим мухолифи изҳороти муштараки Русияву Чин аст, ки пас аз музокирот имзо шуд. Бинобар ин, бо гуфтаҳои намояндаи худ дар СММ, Чин аз амалкарди Маскав изҳори норозигӣ кард, вагарна намояндаи Чин метавонист дар ҷараёни мулоқот танҳо хомӯш бимонад ва ё изҳороти бетарафона кунад, чуноне ки чандин маротиба сурат гирифта буд. Аз гуфтаҳои боло метавон ба чунин ду хулоса расид: бар асоси таҳлили матбуоти ғарбӣ ва изҳороти расмӣ, чунин ба назар мерасад, ки ""ҷанҷоли ҳастаӣ""-и нав муносибати ИМА ва кишварҳои Иттиҳоди Аврупоро нисбат ба низоъ дар Украина тағйир медиҳад ва на ба самте, ки Москва мехоҳад. Яъне, акнун эҳтимол дорад, ки дар зери таҳдиди истифодаи силоҳи тактикии ҳастаӣ, ""Ғарби дастаҷамъӣ"" назар ба коҳиш, дастгирии худро аз Украина бо молия ва аслиҳаи (truncated)","list(original = ""https://www.facebook.com/asiaplustoj/photos/a.107831551457710/566052635635597/?type=3"", expanded = ""https://www.facebook.com/asiaplustoj/photos/a.107831551457710/566052635635597/?type=3"")","https://www.facebook.com/asiaplustoj/photos/a.107831551457710/566052635635597/?type=3","https://www.facebook.com/101247672116098/posts/566052675635593","12662","-24","list(type = ""photo"", url = ""https://scontent-sea1-1.xx.fbcdn.net/v/t39.30808-6/336361972_1340319853418012_7983153248364112451_n.jpg?stp=dst-jpg_p720x720&_nc_cat=101&ccb=1-7&_nc_sid=8bfeb9&_nc_ohc=COggvzOps0cAX-BDZVD&_nc_ht=scontent-sea1-1.xx&oh=00_AfCx_13cx6k2Ahfcm5WNl8j0PSDPsrAGXDHXw2kjBoNsxg&oe=643B20F8"", height = 720, width = 720, full = ""https://scontent-sea1-1.xx.fbcdn.net/v/t39.30808-6/336361972_1340319853418012_7983153248364112451_n.jpg?stp=dst-jpg_p720x720&_nc_cat=101&ccb=1-7&_nc_sid=8bfeb9&_nc_ohc=COggvzOps0cAX-BDZVD&_nc_ht=scontent-sea1-1.xx&oh=00_AfCx_13cx6k2Ahfcm5WNl8j0PSDPsrAGXDHXw2kjBoNsxg&oe=643B20F8"")","tg","0","15307710|566052675635593",NA,NA,NA,"як хафтаи чахон .asia+","NA","1","0","0","0","0","0","0","0","0","0","5","7","3","2","1","2","3","1","0","2","15307710","Азия-Плюс тоҷикӣ","https://scontent-sea1-1.xx.fbcdn.net/v/t39.30808-1/326207540_1404165613740997_4847307966916662132_n.jpg?stp=cp0_dst-jpg_p50x50&_nc_cat=104&ccb=1-7&_nc_sid=5f2048&_nc_ohc=pHuEFv72pUQAX_s6tzD&_nc_oc=AQlBxHKax2PDpoB0nF6Hy-jDkkX8jmJqKvJ-NxiPllRbb1_OOkat4CLb6dUhnRtwM_M&_nc_ht=scontent-sea1-1.xx&oh=00_AfD7vtgQl8-QxC8XB5xEsCvokiaZUUppdLNY3YcJdDpKng&oe=65455F72","26518","https://www.facebook.com/101247672116098","Facebook","100067299570815","facebook_page","MEDIA_NEWS_COMPANY","FALSE","asiaplustoj","TJ","Ҳамаи хабарҳои Тоҷикистон аз Гурӯҳи расонаҳои ""Азия-Плюс""

","2021-04-22 10:26:22"
"63","2687496087982977_6178545975544620","Facebook","2023-04-04 19:21:49","2023-04-06 20:24:38","link",NA,"list(original = ""https://www.stoletie.ru/lenta/lavrov_jevrosojuz_poteral_rossiju_791.htm"", expanded = ""https://www.stoletie.ru/lenta/lavrov_jevrosojuz_poteral_rossiju_791.htm"")","https://www.stoletie.ru/lenta/lavrov_jevrosojuz_poteral_rossiju_791.htm","https://www.facebook.com/groups/2687496087982977/permalink/6178545975544620","11955","-0.769230769230769","list(type = ""photo"", url = ""https://external-sea1-1.xx.fbcdn.net/emg1/v/t13/4985556180030376604?url=https%3A%2F%2Fstoletie.ru%2Fupload%2Fiblock%2F994%2Fydhv9yo2njufbp528zy27xwg8nehnfo0%2FTASS_50460778.jpg&fb_obo=1&utld=stoletie.ru&stp=c0.5000x0.5000f_dst-emg0_p95x95_q75&ccb=13-1&oh=06_AbHLK7riWd7RHNbX3g-WEdCFoOGtEY_20EYuGVY1ZtolYw&oe=642E4999&_nc_sid=6ac203"", height = 95, width = 95, full = ""https://external-sea1-1.xx.fbcdn.net/emg1/v/t13/4985556180030376604?url=https%3A%2F%2Fstoletie.ru%2Fupload%2Fiblock%2F994%2Fydhv9yo2njufbp528zy27xwg8nehnfo0%2FTASS_50460778.jpg&fb_obo=1&utld=stoletie.ru&stp=dst-emg0_q75&ccb=13-1&oh=06_AbHM7jFi4GRfoghuWxJiY4qPEb2e0ZOOPeqxYpHTIkzGMg&oe=642E4999&_nc_sid=5f3a21"")","und","0","11589954|6178545975544620","This is a re-share of a post",NA,"Lavrov: The European Union has lost Russia
04.04.2023
  Lavrov: The European Union has lost Russia
Russian Foreign Minister Sergey Lavrov said in an interview with Argumenty I Fakty that the European Union (EU) ""lost"" Russia through its own fault, so now Moscow considers the bloc as an unfriendly association.

""The European Union has lost Russia. But it's his own fault. After all, it is the EU member states and the leaders of the union itself who openly declare the need to inflict what they call a strategic defeat on Russia. They are pumping the criminal Kiev regime with weapons and ammunition, sending instructors and mercenaries to Ukraine. For these reasons, we consider the EU as an unfriendly association, "" the minister said.

According to him, Western countries are not ready for a real dialogue with Moscow today and are looking for new ways to contain it around the clock. At the same time, the Minister recalled that Russia remains open to cooperation on an equal basis and taking into account Russian interests ""in order to improve the situation in Europe and the Euro-Atlantic region, and to reduce long-term nuclear risks.""

""If the Europeans at some point abandon their anti-Russian course and make a choice in favor of a mutually respectful dialogue with Russia, we will consider their proposals and make decisions based on our national interests,"" Lavrov concluded.

Since the start of the military operation in Ukraine, the Russian Foreign Ministry has repeatedly criticized Western countries for ""illegal"" sanctions and"" pumping "" Kiev with weapons. Lavrov said that by arming Ukraine, NATO countries, in fact, are entering into a ""proxy war"" with Russia. The minister also announced the formation of the EU and NATO coalition for war with Russia, comparing such actions with the policy of Nazi Germany.

""When the Second World War began, Hitler gathered under his banner a significant part, if not most, of the European countries for the war against the Soviet Union. Right now, the EU and NATO are also assembling the same modern coalition to fight, and by and large, war with the Russian Federation,"" Lavrov said.

The Russian Foreign Minister commented on China's peace plan for a settlement in Ukraine, noting that Moscow's position is largely consonant with Beijing's ideas. However, Kiev and Western countries are making every effort to prolong the conflict, Lavrov stressed.

""Especially in terms of the need to ensure equal and indivisible security for all countries in Europe and in the world as a whole. In the meantime, the peace process is being slowed down by Kiev and its Western curators, who are making every effort to delay the fighting,"" Lavrov said.

The Foreign Minister recalled that Russian and Chinese leaders Vladimir Putin and Xi Jinping noted similar views on the causes of major international security problems. He added that the West does not want to conduct a dialogue based on the principles of equality, while Moscow opposes sanctions pressure and other manifestations of unfair competition.

Based on RBC materials, Lenta.ru, Rossiyskaya Gazeta",NA,"NA","2","0","0","1","0","0","0","0","0","0","2","2","2","2","1","2","1","1","0","1","11589954","В.В. Путин, президент России- надежда и покровитель мира во всем мире","https://scontent-sea1-1.xx.fbcdn.net/v/t39.30808-6/271745445_10220712137857715_7499008787316481859_n.jpg?stp=c3.0.50.50a_cp0_dst-jpg_p50x50&_nc_cat=108&ccb=1-7&_nc_sid=5f2048&_nc_ohc=nJqSFHK89T0AX_j6k2d&_nc_ht=scontent-sea1-1.xx&oh=00_AfA2XJUeDoTvOaMe5gADLS1Uzu0xigqLHRZ8LwVynr9zBA&oe=6545382C","11941","https://www.facebook.com/groups/2687496087982977","Facebook","2687496087982977","facebook_group","none","FALSE",NA,NA,NA,NA
"64","369911626677440_1958042587864328","Facebook","2023-04-03 09:00:01","2023-04-14 13:15:55","link","В американском штате Монтана сошли с рельсов 25 вагонов, в которых перевозилось пиво.","list(original = ""https://news.day.az/world/1551949.html"", expanded = ""https://news.day.az/world/1551949.html"")","https://news.day.az/world/1551949.html","https://www.facebook.com/369911626677440/posts/1958042587864328","642201","-34","list(type = ""photo"", url = ""https://external-sea1-1.xx.fbcdn.net/emg1/v/t13/957374055624802801?url=https%3A%2F%2Fimg.day.az%2F2023%2F04%2F03%2F1a975231-829f-4595-a48d-dca6bbba4906-trainderailment1ctsydaffneyclairmont.jpg&fb_obo=1&utld=day.az&stp=c0.5000x0.5000f_dst-emg0_p450x450_q75&ccb=13-1&oh=06_AbEMS4nzW_dD8LRVdXkfElglYWs2Qbu5m4OnGm6mKKvlVw&oe=643ABDF6&_nc_sid=6ac203"", height = 450, width = 450, full = ""https://external-sea1-1.xx.fbcdn.net/emg1/v/t13/957374055624802801?url=https%3A%2F%2Fimg.day.az%2F2023%2F04%2F03%2F1a975231-829f-4595-a48d-dca6bbba4906-trainderailment1ctsydaffneyclairmont.jpg&fb_obo=1&utld=day.az&ccb=13-1&_nc_sid=834697&stp=dst-emg0_q75&ur=64c8fc&oh=06_AbGMH7T82Zic-Dlg5NZgYWbNu1NSMapVtMzzmPLy5ypRwQ&oe=643ABDF6"")","ru","0","2559822|1958042587864328","В США сошли с рельсов вагоны с пивом - ФОТО - ВИДЕО","news.day.az","В американском штате Монтана сошли с рельсов 25 вагонов, в которых перевозилось пиво. Об этом сообщает телестанция NBC Montana, передает Day.Az со ссылкой на Lenta.ru.",NA,"NA","0","0","0","0","0","0","0","0","0","0","2","2","2","2","2","2","3","2","0","4","2559822","DayTube","https://scontent-sea1-1.xx.fbcdn.net/v/t39.30808-1/352790775_780452463572591_7776823999917924264_n.jpg?stp=cp0_dst-jpg_p50x50&_nc_cat=100&ccb=1-7&_nc_sid=5f2048&_nc_ohc=WbZB2hjxt_cAX8p72kx&_nc_ht=scontent-sea1-1.xx&oh=00_AfAamMAxmqEverUYjVkdDBJGaaoxHVwaHyV9Kb8gj6cF3A&oe=65449126","639649","https://www.facebook.com/369911626677440","Facebook","100076284782868","facebook_page","ACTIVITY_GENERAL","FALSE",NA,"AZ","DayTubе - это самые популярные и интересные, развлекательные и познавательные видеоролики.","2016-11-20 11:39:33"
"65","554365331332852_5250728605029811","Facebook","2023-04-02 11:02:57","2023-04-04 12:10:10","link","# “Çin müharibəni həll edə bilməz” – Özəl","list(original = ""https://aktualtv.az/2023/04/02/cin-muharib%c9%99ni-h%c9%99ll-ed%c9%99-bilm%c9%99z-oz%c9%99l/"", expanded = ""https://aktualtv.az/2023/04/02/cin-muharib%c9%99ni-h%c9%99ll-ed%c9%99-bilm%c9%99z-oz%c9%99l/"")","https://aktualtv.az/2023/04/02/cin-muharib%c9%99ni-h%c9%99ll-ed%c9%99-bilm%c9%99z-oz%c9%99l/","https://www.facebook.com/groups/554365331332852/permalink/5250728605029811","54200","-20","list(type = ""photo"", url = ""https://external-sea1-1.xx.fbcdn.net/emg1/v/t13/6778082866372463889?url=https%3A%2F%2Faktualtv.az%2Fwp-content%2Fuploads%2Fsites%2F37%2F2019%2F11%2FAktual-TV-Logo.png&fb_obo=1&utld=aktualtv.az&stp=c0.5000x0.5000f_dst-emg0_p178x178_q75&ccb=13-1&oh=06_AbGNJUEZqlHxMDRB40N60Emapxo03TwvlH47_iBCzJOaCQ&oe=642B026A&_nc_sid=6ac203"", height = 178, width = 178, full = ""https://external-sea1-1.xx.fbcdn.net/emg1/v/t13/6778082866372463889?url=https%3A%2F%2Faktualtv.az%2Fwp-content%2Fuploads%2Fsites%2F37%2F2019%2F11%2FAktual-TV-Logo.png&fb_obo=1&utld=aktualtv.az&stp=dst-emg0_q75&ccb=13-1&oh=06_AbGGvL2ONd0NdlXX7lK2YHj5WyTvBnqFV3oR2WvpIb8H9A&oe=642B026A&_nc_sid=5f3a21"")","az","0","12945497|5250728605029811","""Çin müharibəni həll edə bilməz"" – Özəl - Aktual TV","aktualtv.az","“Çin Ukrayna müharibəsinin həllində vasitəçi ola bilməz”. Aktualtv.az Lenta.ru-ya istinadən xəbər verir ki, bunu Avropa İttifaqının (Aİ) Xarici Əlaqələr və Təhlükəsizlik Siyasəti üzrə Ali Nümayəndəsi Jozep Borrel deyib. “El Espanol” tərəfindən təşkil edilən ...",NA,"NA","0","0","0","0","0","0","0","0","0","0","2","1","2","1","1","1","1","1","0","1","12945497","Baku NEWS (Bakunews.az)","https://scontent-sea1-1.xx.fbcdn.net/v/t1.18169-9/27867552_2061935474087945_3906448387078187341_n.jpg?stp=c11.0.50.50a_cp0_dst-jpg_p50x50&_nc_cat=105&ccb=1-7&_nc_sid=f2fd11&_nc_ohc=Mb1ZziL3IKQAX8MDWIZ&_nc_ht=scontent-sea1-1.xx&oh=00_AfDBpVl0bMKo28fFzUpjrR4m-zyfd2Cp_U0iL97O9InEhQ&oe=6567535B","54309","https://www.facebook.com/groups/554365331332852","Facebook","554365331332852","facebook_group","none","FALSE",NA,NA,NA,NA
"66","228536107698219_1293414401210379","Facebook","2023-04-02 10:21:42","2023-04-04 08:36:14","link","# “Çin müharibəni həll edə bilməz” – Özəl","list(original = ""https://aktualtv.az/2023/04/02/cin-muharib%c9%99ni-h%c9%99ll-ed%c9%99-bilm%c9%99z-oz%c9%99l/"", expanded = ""https://aktualtv.az/2023/04/02/cin-muharib%c9%99ni-h%c9%99ll-ed%c9%99-bilm%c9%99z-oz%c9%99l/"")","https://aktualtv.az/2023/04/02/cin-muharib%c9%99ni-h%c9%99ll-ed%c9%99-bilm%c9%99z-oz%c9%99l/","https://www.facebook.com/groups/228536107698219/permalink/1293414401210379","24423","-28","list(type = ""photo"", url = ""https://external-sea1-1.xx.fbcdn.net/emg1/v/t13/6778082866372463889?url=https%3A%2F%2Faktualtv.az%2Fwp-content%2Fuploads%2Fsites%2F37%2F2019%2F11%2FAktual-TV-Logo.png&fb_obo=1&utld=aktualtv.az&stp=c0.5000x0.5000f_dst-emg0_p178x178_q75&ccb=13-1&oh=06_AbGNJUEZqlHxMDRB40N60Emapxo03TwvlH47_iBCzJOaCQ&oe=642B026A&_nc_sid=6ac203"", height = 178, width = 178, full = ""https://external-sea1-1.xx.fbcdn.net/emg1/v/t13/6778082866372463889?url=https%3A%2F%2Faktualtv.az%2Fwp-content%2Fuploads%2Fsites%2F37%2F2019%2F11%2FAktual-TV-Logo.png&fb_obo=1&utld=aktualtv.az&stp=dst-emg0_q75&ccb=13-1&oh=06_AbGGvL2ONd0NdlXX7lK2YHj5WyTvBnqFV3oR2WvpIb8H9A&oe=642B026A&_nc_sid=5f3a21"")","az","0","12946037|1293414401210379","""Çin müharibəni həll edə bilməz"" – Özəl - Aktual TV","aktualtv.az","“Çin Ukrayna müharibəsinin həllində vasitəçi ola bilməz”. Aktualtv.az Lenta.ru-ya istinadən xəbər verir ki, bunu Avropa İttifaqının (Aİ) Xarici Əlaqələr və Təhlükəsizlik Siyasəti üzrə Ali Nümayəndəsi Jozep Borrel deyib. “El Espanol” tərəfindən təşkil edilən ...",NA,"NA","0","0","0","0","0","0","0","0","0","0","2","3","2","1","1","2","1","2","0","0","12946037","XƏBƏRLƏR 24","https://scontent-sea1-1.xx.fbcdn.net/v/t39.30808-6/363771078_2045902115787687_5448449597147573480_n.jpg?stp=c19.0.50.50a_cp0_dst-jpg_p50x50&_nc_cat=101&ccb=1-7&_nc_sid=5f2048&_nc_ohc=45mS7qH6gHsAX85CFLv&_nc_ht=scontent-sea1-1.xx&oh=00_AfBn7kVpxs9hIIX54YaFjjpcM_SvfnuADzDaPhR9BRdx4A&oe=6544413B","25000","https://www.facebook.com/groups/228536107698219","Facebook","228536107698219","facebook_group","none","FALSE",NA,NA,NA,NA
"67","1238507722893209_6003550779722189","Facebook","2023-04-02 10:21:23","2023-04-04 16:48:18","link","# “Çin müharibəni həll edə bilməz” – Özəl","list(original = ""https://aktualtv.az/2023/04/02/cin-muharib%c9%99ni-h%c9%99ll-ed%c9%99-bilm%c9%99z-oz%c9%99l/"", expanded = ""https://aktualtv.az/2023/04/02/cin-muharib%c9%99ni-h%c9%99ll-ed%c9%99-bilm%c9%99z-oz%c9%99l/"")","https://aktualtv.az/2023/04/02/cin-muharib%c9%99ni-h%c9%99ll-ed%c9%99-bilm%c9%99z-oz%c9%99l/","https://www.facebook.com/groups/1238507722893209/permalink/6003550779722189","16348","-20","list(type = ""photo"", url = ""https://external-sea1-1.xx.fbcdn.net/emg1/v/t13/6778082866372463889?url=https%3A%2F%2Faktualtv.az%2Fwp-content%2Fuploads%2Fsites%2F37%2F2019%2F11%2FAktual-TV-Logo.png&fb_obo=1&utld=aktualtv.az&stp=c0.5000x0.5000f_dst-emg0_p178x178_q75&ccb=13-1&oh=06_AbGNJUEZqlHxMDRB40N60Emapxo03TwvlH47_iBCzJOaCQ&oe=642B026A&_nc_sid=6ac203"", height = 178, width = 178, full = ""https://external-sea1-1.xx.fbcdn.net/emg1/v/t13/6778082866372463889?url=https%3A%2F%2Faktualtv.az%2Fwp-content%2Fuploads%2Fsites%2F37%2F2019%2F11%2FAktual-TV-Logo.png&fb_obo=1&utld=aktualtv.az&stp=dst-emg0_q75&ccb=13-1&oh=06_AbGGvL2ONd0NdlXX7lK2YHj5WyTvBnqFV3oR2WvpIb8H9A&oe=642B026A&_nc_sid=5f3a21"")","az","0","12945556|6003550779722189","""Çin müharibəni həll edə bilməz"" – Özəl - Aktual TV","aktualtv.az","“Çin Ukrayna müharibəsinin həllində vasitəçi ola bilməz”. Aktualtv.az Lenta.ru-ya istinadən xəbər verir ki, bunu Avropa İttifaqının (Aİ) Xarici Əlaqələr və Təhlükəsizlik Siyasəti üzrə Ali Nümayəndəsi Jozep Borrel deyib. “El Espanol” tərəfindən təşkil edilən ...",NA,"NA","0","0","0","0","0","0","0","0","0","0","2","1","2","1","1","1","1","1","0","1","12945556","Israel Azerbaycan dostluk qrupu","https://scontent-sea1-1.xx.fbcdn.net/v/t39.30808-6/386103413_6669868253092622_6409731591731827082_n.png?stp=c13.0.50.50a_cp0_dst-png_p50x50&_nc_cat=111&ccb=1-7&_nc_sid=5f2048&_nc_ohc=Fji9YlczH3cAX-YOxKG&_nc_oc=AQm0Zu43JUEb27GOzG861XmsDYFUBnkXOmmTlM-hAyMwztbtv5-hJnGyvAJUpfC6Chs&_nc_ht=scontent-sea1-1.xx&oh=00_AfDWUxAw1OhkjhkMjqVs-Apje0qGHl2MX_gbZLybWT1tgA&oe=65458CC4","16433","https://www.facebook.com/groups/1238507722893209","Facebook","1238507722893209","facebook_group","none","FALSE",NA,NA,NA,NA
