"45","2838135156460333_3398825220391321","Facebook","2023-04-07 18:22:21","2023-10-09 13:37:00","photo",NA,"list(original = ""https://www.facebook.com/photo.php?fbid=178121238422992&set=p.178121238422992&type=3"", expanded = ""https://www.facebook.com/photo.php?fbid=178121238422992&set=p.178121238422992&type=3"")","https://www.facebook.com/photo.php?fbid=178121238422992&set=p.178121238422992&type=3","https://www.facebook.com/groups/2838135156460333/permalink/3398825220391321","0","-32","list(type = ""photo"", url = ""https://scontent-sea1-1.xx.fbcdn.net/v/t39.30808-6/340256850_109578315437225_9046947536606174310_n.jpg?_nc_cat=108&ccb=1-7&_nc_sid=49d041&_nc_ohc=HcCKzyRCmfgAX-q1t-n&_nc_ht=scontent-sea1-1.xx&oh=00_AfBNT6FWtS30tPwqSaw20RGbU8NFijO6jfcOIhxu_vJygA&oe=652887FD"", height = 675, width = 943, full = ""https://scontent-sea1-1.xx.fbcdn.net/v/t39.30808-6/340256850_109578315437225_9046947536606174310_n.jpg?_nc_cat=108&ccb=1-7&_nc_sid=49d041&_nc_ohc=HcCKzyRCmfgAX-q1t-n&_nc_ht=scontent-sea1-1.xx&oh=00_AfBNT6FWtS30tPwqSaw20RGbU8NFijO6jfcOIhxu_vJygA&oe=652887FD"")","und","0","24207584|3398825220391321",NA,NA,"Csendes hírszerzési háború: A Pentagonból való kiszivárogtatás az ellenségeskedés axiómájává vált
07.04.2023
Nem ez az első alkalom, hogy az Egyesült Államok szembesül a minősített információk kiszivárogtatásának következményeivel. Ennek oka nem csak a gondatlanságban rejlik.
A The New York Times (NYT) amerikai kiadása beszámol a Pentagon vizsgálatáról az ukrán válságról szóló titkos dokumentumok hálózatnak való kiszivárogtatásának körülményeivel kapcsolatban. A közzétett dokumentumok rögzítették a ""konfliktus állapotát március 1-jén"", és leírták, hogy a Nyugat milyen terveket készít az ukrán fegyveres erők katonáinak kiképzésére. Különösen 12 brigád megalakulásáról tartalmaz információkat, amelyek közül kilencet az Egyesült Államok és NATO-szövetségesei képeznek és szállítanak. Azt is jelezték, hogy ezeknek az egységeknek több mint 250 tartály és legalább 350 IFV áll majd rendelkezésükre.
A NYT újságírói azt állítják, hogy az orosz kormánypárti Telegram-csatornák felelősek ezen információk terjesztéséért. A minősített információk szivárgásának oka lehet a Pentagon banális gondatlansága, Vaszilij Dandykin katonai szakértő szerint. Elmondása szerint az amerikai katonai osztály már elkövetett ilyen hibákat. Nem zárható ki azonban, hogy e dokumentumok közzététele az Orosz Föderáció hírszerző szolgálatainak munkája. Felismerve, hogy az Egyesült Államok által vezetett Nyugat felügyeli az ukrán fegyveres erők összes tervét, Oroszországnak minden lehetőséget ki kell használnia, hogy megelőzze az ellenséges csapásokat és saját maga okozzon.
""Ez minden ellenségeskedés axiómája. Nagyjából ezek nem csak tankok és repülőgépek, hanem csendes háború is – a hírszerzés háborúja. Ezért nagyon fontos szempont, hogy ki fogja megtudni, mi ""- mondta a szakember a Lenta.ru tudósítójával folytatott interjúban.
Van azonban egy másik verzió is. A katonai bloggerek körében úgy vélik, hogy a ""titkos"" információk kiszivárgása banális dezinformáció. Lehetséges, hogy a Pentagon ""szivárogni"" kíván annak érdekében, hogy az Orosz Föderáció katonai parancsnokságát hibára kényszerítse.",NA,"NA","0","0","0","0","0","0","0","0","0","0","6","2","2","3","0","0","3","0","0","4","24207584","Szentgotthárdi Magazin","https://scontent-sea1-1.xx.fbcdn.net/v/t1.6435-9/159048325_2823454377912407_1960927531637223821_n.jpg?stp=c9.0.50.50a_cp0_dst-jpg_p50x50&_nc_cat=110&ccb=1-7&_nc_sid=f2fd11&_nc_ohc=p6cuzovMbwsAX9LkyoS&_nc_ht=scontent-sea1-1.xx&oh=00_AfDLrqi-dmiYEBb9KNVxAjAx60deB2IE7qKcjjGTBwsEJg&oe=65675EA2","788","https://www.facebook.com/groups/2838135156460333","Facebook","2838135156460333","facebook_group","none","FALSE",NA,NA,NA,NA
"46","232746656935860_2134973356713171","Facebook","2023-04-07 17:35:46","2023-04-09 22:00:07","status","Трамп сможет стать президентом даже в тюрьме - Lenta.ru ЛентаРу, вы главное проинформируйте путина, что так тоже можно.. (С)","NULL",NA,"https://www.facebook.com/groups/232746656935860/permalink/2134973356713171","100189","-1.76056338028169","NULL","ru","0","10772800|2134973356713171",NA,NA,NA,NA,"NA","29","1","0","1","0","40","0","0","0","0","58","14","8","6","4","29","4","2","0","3","10772800","АНТИВАТНИК","https://scontent-sea1-1.xx.fbcdn.net/v/t1.18169-9/10375128_319661488200950_8835722603293412077_n.jpg?stp=c55.0.50.50a_cp0_dst-jpg_p50x50&_nc_cat=103&ccb=1-7&_nc_sid=f2fd11&_nc_ohc=P8Dt97xfJh4AX-PUbAH&_nc_ht=scontent-sea1-1.xx&oh=00_AfB0amczcLugXuq6DXKN24i1zPPnEpuweQJ1lpO5aMDnjQ&oe=65673FE1","96785","https://www.facebook.com/groups/232746656935860","Facebook","232746656935860","facebook_group","none","FALSE",NA,NA,NA,NA
"47","554365331332852_5265336336902371","Facebook","2023-04-07 16:27:42","2023-04-09 19:29:39","link","# Makron Si Cinpinə qarşı səhvə yol verdi – Özəl","list(original = ""https://aktualtv.az/2023/04/07/makron-si-cinpin%c9%99-qarsi-s%c9%99hv%c9%99-yol-verdi-oz%c9%99l/"", expanded = ""https://aktualtv.az/2023/04/07/makron-si-cinpin%c9%99-qarsi-s%c9%99hv%c9%99-yol-verdi-oz%c9%99l/"")","https://aktualtv.az/2023/04/07/makron-si-cinpin%c9%99-qarsi-s%c9%99hv%c9%99-yol-verdi-oz%c9%99l/","https://www.facebook.com/groups/554365331332852/permalink/5265336336902371","54197","-20","list(type = ""photo"", url = ""https://external-sea1-1.xx.fbcdn.net/emg1/v/t13/5180598122128899331?url=https%3A%2F%2Faktualtv.az%2Fwp-content%2Fuploads%2Fsites%2F37%2F2023%2F04%2Fb-chifra-a-20190327-870x489-1.jpg&fb_obo=1&utld=aktualtv.az&stp=c0.5000x0.5000f_dst-emg0_p413x413_q75&ccb=13-1&oh=06_AbEMowLU3T8jF1I0ccMk6ZC5UPXwyh8UFXR04ZI6qR1rjQ&oe=6434FC58&_nc_sid=6ac203"", height = 413, width = 413, full = ""https://external-sea1-1.xx.fbcdn.net/emg1/v/t13/5180598122128899331?url=https%3A%2F%2Faktualtv.az%2Fwp-content%2Fuploads%2Fsites%2F37%2F2023%2F04%2Fb-chifra-a-20190327-870x489-1.jpg&fb_obo=1&utld=aktualtv.az&ccb=13-1&_nc_sid=834697&stp=dst-emg0_q75&ur=64c8fc&oh=06_AbGquIxMv6sD1Immkcck3RIxEAzr7rNBC7aWd6DRduoirA&oe=6434FC58"")","az","0","12945497|5265336336902371","Makron Si Cinpinə qarşı səhvə yol verdi – Özəl - Aktual TV","aktualtv.az","Fransa Prezidenti Emmanuel Makron Çin Prezidenti Si Cinpinlə birgə mətbuat konfransı zamanı diplomatik səhvə yol verib. Aktualtv.az lenta.ru-ya istinadən xəbər verir ki, fransız siyasətçi mətbuat qarşısında çıxış edərkən Çin liderindən iki dəfə çox danışıb. Bu zaman S...",NA,"NA","0","0","0","0","0","0","0","0","0","0","2","1","2","1","1","1","1","1","0","1","12945497","Baku NEWS (Bakunews.az)","https://scontent-sea1-1.xx.fbcdn.net/v/t1.18169-9/27867552_2061935474087945_3906448387078187341_n.jpg?stp=c11.0.50.50a_cp0_dst-jpg_p50x50&_nc_cat=105&ccb=1-7&_nc_sid=f2fd11&_nc_ohc=Mb1ZziL3IKQAX8MDWIZ&_nc_ht=scontent-sea1-1.xx&oh=00_AfDBpVl0bMKo28fFzUpjrR4m-zyfd2Cp_U0iL97O9InEhQ&oe=6567535B","54309","https://www.facebook.com/groups/554365331332852","Facebook","554365331332852","facebook_group","none","FALSE",NA,NA,NA,NA
"48","228536107698219_1296006257617860","Facebook","2023-04-07 16:01:43","2023-04-09 13:01:43","link","# Makron Si Cinpinə qarşı səhvə yol verdi – Özəl","list(original = ""https://aktualtv.az/2023/04/07/makron-si-cinpin%c9%99-qarsi-s%c9%99hv%c9%99-yol-verdi-oz%c9%99l/"", expanded = ""https://aktualtv.az/2023/04/07/makron-si-cinpin%c9%99-qarsi-s%c9%99hv%c9%99-yol-verdi-oz%c9%99l/"")","https://aktualtv.az/2023/04/07/makron-si-cinpin%c9%99-qarsi-s%c9%99hv%c9%99-yol-verdi-oz%c9%99l/","https://www.facebook.com/groups/228536107698219/permalink/1296006257617860","24415","-24","list(type = ""photo"", url = ""https://external-sea1-1.xx.fbcdn.net/emg1/v/t13/5180598122128899331?url=https%3A%2F%2Faktualtv.az%2Fwp-content%2Fuploads%2Fsites%2F37%2F2023%2F04%2Fb-chifra-a-20190327-870x489-1.jpg&fb_obo=1&utld=aktualtv.az&stp=c0.5000x0.5000f_dst-emg0_p413x413_q75&ccb=13-1&oh=06_AbFqgcMJPlArNAFVxGKQfsbb9wyqzkSZr9ESua0qq-PvAg&oe=6431B098&_nc_sid=6ac203"", height = 413, width = 413, full = ""https://external-sea1-1.xx.fbcdn.net/emg1/v/t13/5180598122128899331?url=https%3A%2F%2Faktualtv.az%2Fwp-content%2Fuploads%2Fsites%2F37%2F2023%2F04%2Fb-chifra-a-20190327-870x489-1.jpg&fb_obo=1&utld=aktualtv.az&ccb=13-1&_nc_sid=834697&stp=dst-emg0_q75&ur=64c8fc&oh=06_AbGmemUoF5KviiBk4nPJhtgfP4ASbzc6V9f-W3wsbiz98g&oe=6431B098"")","az","0","12946037|1296006257617860","Makron Si Cinpinə qarşı səhvə yol verdi – Özəl - Aktual TV","aktualtv.az","Fransa Prezidenti Emmanuel Makron Çin Prezidenti Si Cinpinlə birgə mətbuat konfransı zamanı diplomatik səhvə yol verib. Aktualtv.az lenta.ru-ya istinadən xəbər verir ki, fransız siyasətçi mətbuat qarşısında çıxış edərkən Çin liderindən iki dəfə çox danışıb. Bu zaman S...",NA,"NA","0","0","0","0","0","0","0","0","0","0","2","3","2","1","1","1","1","1","0","0","12946037","XƏBƏRLƏR 24","https://scontent-sea1-1.xx.fbcdn.net/v/t39.30808-6/363771078_2045902115787687_5448449597147573480_n.jpg?stp=c19.0.50.50a_cp0_dst-jpg_p50x50&_nc_cat=101&ccb=1-7&_nc_sid=5f2048&_nc_ohc=45mS7qH6gHsAX85CFLv&_nc_ht=scontent-sea1-1.xx&oh=00_AfBn7kVpxs9hIIX54YaFjjpcM_SvfnuADzDaPhR9BRdx4A&oe=6544413B","25000","https://www.facebook.com/groups/228536107698219","Facebook","228536107698219","facebook_group","none","FALSE",NA,NA,NA,NA
"49","1238507722893209_6018811838196083","Facebook","2023-04-07 16:01:21","2023-04-09 16:35:44","link","# Makron Si Cinpinə qarşı səhvə yol verdi – Özəl","list(original = ""https://aktualtv.az/2023/04/07/makron-si-cinpin%c9%99-qarsi-s%c9%99hv%c9%99-yol-verdi-oz%c9%99l/"", expanded = ""https://aktualtv.az/2023/04/07/makron-si-cinpin%c9%99-qarsi-s%c9%99hv%c9%99-yol-verdi-oz%c9%99l/"")","https://aktualtv.az/2023/04/07/makron-si-cinpin%c9%99-qarsi-s%c9%99hv%c9%99-yol-verdi-oz%c9%99l/","https://www.facebook.com/groups/1238507722893209/permalink/6018811838196083","16347","-20","list(type = ""photo"", url = ""https://external-sea1-1.xx.fbcdn.net/emg1/v/t13/5180598122128899331?url=https%3A%2F%2Faktualtv.az%2Fwp-content%2Fuploads%2Fsites%2F37%2F2023%2F04%2Fb-chifra-a-20190327-870x489-1.jpg&fb_obo=1&utld=aktualtv.az&stp=c0.5000x0.5000f_dst-emg0_p413x413_q75&ccb=13-1&oh=06_AbFqgcMJPlArNAFVxGKQfsbb9wyqzkSZr9ESua0qq-PvAg&oe=6431B098&_nc_sid=6ac203"", height = 413, width = 413, full = ""https://external-sea1-1.xx.fbcdn.net/emg1/v/t13/5180598122128899331?url=https%3A%2F%2Faktualtv.az%2Fwp-content%2Fuploads%2Fsites%2F37%2F2023%2F04%2Fb-chifra-a-20190327-870x489-1.jpg&fb_obo=1&utld=aktualtv.az&ccb=13-1&_nc_sid=834697&stp=dst-emg0_q75&ur=64c8fc&oh=06_AbGmemUoF5KviiBk4nPJhtgfP4ASbzc6V9f-W3wsbiz98g&oe=6431B098"")","az","0","12945556|6018811838196083","Makron Si Cinpinə qarşı səhvə yol verdi – Özəl - Aktual TV","aktualtv.az","Fransa Prezidenti Emmanuel Makron Çin Prezidenti Si Cinpinlə birgə mətbuat konfransı zamanı diplomatik səhvə yol verib. Aktualtv.az lenta.ru-ya istinadən xəbər verir ki, fransız siyasətçi mətbuat qarşısında çıxış edərkən Çin liderindən iki dəfə çox danışıb. Bu zaman S...",NA,"NA","0","0","0","0","0","0","0","0","0","0","2","1","2","1","1","1","1","1","0","1","12945556","Israel Azerbaycan dostluk qrupu","https://scontent-sea1-1.xx.fbcdn.net/v/t39.30808-6/386103413_6669868253092622_6409731591731827082_n.png?stp=c13.0.50.50a_cp0_dst-png_p50x50&_nc_cat=111&ccb=1-7&_nc_sid=5f2048&_nc_ohc=Fji9YlczH3cAX-YOxKG&_nc_oc=AQm0Zu43JUEb27GOzG861XmsDYFUBnkXOmmTlM-hAyMwztbtv5-hJnGyvAJUpfC6Chs&_nc_ht=scontent-sea1-1.xx&oh=00_AfDWUxAw1OhkjhkMjqVs-Apje0qGHl2MX_gbZLybWT1tgA&oe=65458CC4","16433","https://www.facebook.com/groups/1238507722893209","Facebook","1238507722893209","facebook_group","none","FALSE",NA,NA,NA,NA
"50","220154419332349_938788007468983","Facebook","2023-04-07 16:01:08","2023-05-05 10:05:43","link","# Makron Si Cinpinə qarşı səhvə yol verdi – Özəl","list(original = ""https://aktualtv.az/2023/04/07/makron-si-cinpin%c9%99-qarsi-s%c9%99hv%c9%99-yol-verdi-oz%c9%99l/"", expanded = ""https://aktualtv.az/2023/04/07/makron-si-cinpin%c9%99-qarsi-s%c9%99hv%c9%99-yol-verdi-oz%c9%99l/"")","https://aktualtv.az/2023/04/07/makron-si-cinpin%c9%99-qarsi-s%c9%99hv%c9%99-yol-verdi-oz%c9%99l/","https://www.facebook.com/groups/220154419332349/permalink/938788007468983","3120","-46","list(type = ""photo"", url = ""https://external-fco2-1.xx.fbcdn.net/emg1/v/t13/5180598122128899331?url=https%3A%2F%2Faktualtv.az%2Fwp-content%2Fuploads%2Fsites%2F37%2F2023%2F04%2Fb-chifra-a-20190327-870x489-1.jpg&fb_obo=1&utld=aktualtv.az&stp=c0.5000x0.5000f_dst-emg0_p413x413_q75&ccb=13-1&oh=06_AbF0UxKDJI_TmbP9wwe89WEu3KCdCeDEt_XYVioD7o51FA&oe=64612698&_nc_sid=030c62"", height = 413, width = 413, full = ""https://external-fco2-1.xx.fbcdn.net/emg1/v/t13/5180598122128899331?url=https%3A%2F%2Faktualtv.az%2Fwp-content%2Fuploads%2Fsites%2F37%2F2023%2F04%2Fb-chifra-a-20190327-870x489-1.jpg&fb_obo=1&utld=aktualtv.az&ccb=13-1&_nc_sid=791163&stp=dst-emg0_q75&ur=64c8fc&oh=06_AbG_6_qtE3XSutTn1UKpqXNee0NQ1vngw1syOyV0VC0Z3A&oe=64612698"")","az","0","12945870|938788007468983","Makron Si Cinpinə qarşı səhvə yol verdi – Özəl - Aktual TV","aktualtv.az","Fransa Prezidenti Emmanuel Makron Çin Prezidenti Si Cinpinlə birgə mətbuat konfransı zamanı diplomatik səhvə yol verib. Aktualtv.az lenta.ru-ya istinadən xəbər verir ki, fransız siyasətçi mətbuat qarşısında çıxış edərkən Çin liderindən iki dəfə çox danışıb. Bu zaman S...",NA,"NA","0","0","0","0","0","0","0","0","0","0","6","2","2","3","2","2","4","2","0","1","12945870","Aktual TV","https://scontent-sea1-1.xx.fbcdn.net/v/t1.6435-9/92561790_3028895983836703_3428480991474221056_n.jpg?stp=c117.0.50.50a_cp0_dst-jpg_p50x50&_nc_cat=100&ccb=1-7&_nc_sid=f2fd11&_nc_ohc=Tql1cjIGlrsAX8nV7fY&_nc_ht=scontent-sea1-1.xx&oh=00_AfArYnmFXllmOOMqp2byQ71-NY7wCZRwwRe-QihXkanwhw&oe=65676647","3115","https://www.facebook.com/groups/220154419332349","Facebook","220154419332349","facebook_group","none","FALSE",NA,NA,NA,NA
"51","1812668825700828_3104210096546688","Facebook","2023-04-07 01:17:44","2023-04-10 15:07:06","link","Все, больше нам помощи не будет 😪 ","list(original = ""https://lenta.ru/news/2023/03/27/raspad/?utm_medium=social&utm_source=copy"", expanded = ""https://lenta.ru/news/2023/03/27/raspad/?utm_medium=social&utm_source=copy"")","https://lenta.ru/news/2023/03/27/raspad/?utm_medium=social&utm_source=copy","https://www.facebook.com/groups/1812668825700828/permalink/3104210096546688","6056","-46","list(type = ""photo"", url = ""https://www.facebook.com/"", height = 600, width = 600, full = ""https://scontent.xx.fbcdn.net/fb.png"")","ru","0","10976153|3104210096546688","Патрушев рассказал о спасении Россией США от распада","lenta.ru","Россия дважды спасала США от распада, но в третий раз делать этого не станет. Об этом заявил секретарь Совета безопасности России Николай Патрушев. По словам Патруш...",NA,"NA","0","0","0","0","0","0","0","0","0","0","4","2","3","3","2","4","2","3","0","1","10976153","Короли и капуста","https://scontent-sea1-1.xx.fbcdn.net/v/t39.30808-6/279348837_524511935900947_6638453300031253586_n.jpg?stp=c8.0.50.50a_cp0_dst-jpg_p50x50&_nc_cat=102&ccb=1-7&_nc_sid=5f2048&_nc_ohc=X9pNoI4yeIsAX-VfuSs&_nc_ht=scontent-sea1-1.xx&oh=00_AfCdM1kleRhvrZEBoGMwsZAV_T2klv7qRXpi6nxRHSMEFA&oe=65440D96","6413","https://www.facebook.com/groups/1812668825700828","Facebook","1812668825700828","facebook_group","none","FALSE",NA,NA,NA,NA
"52","100063641240437_697470755717626","Facebook","2023-04-06 17:00:15","2023-04-11 06:01:51","status","Си Цзиньпин заявил о подготовке Китая к возможной масштабной войне «Перед лицом войн, которые могут быть нам навязаны, мы должны говорить с врагами на языке, который они понимают, и использовать победу для завоевания мира и уважения. В новую эпоху НОАК настаивает на применении военной силы для прекращения боевых действий», — говорится в эссе Си Цзиньпина, которое было опубликовано перед мартовскими заседаниями парламента КНР. Сообщается, что по указу Си по всему Китаю с декабря 2022 года в интересах НОАК открываются новые военные комиссариаты и пункты сбора, чтобы Пекин мог в кратчайшие сроки «задействовать свои резервные силы и институционализировать систему пополнения боевых частей в случае войны». Ранее официальный представитель Минобороны КНР Тань Кэфэй заявил, что НОАК готова сотрудничать с Вооруженными силами (ВС) России ради укрепления мира и безопасности. Он добавил, что китайская и российская армии планируют усиливать стратегическую координацию и регулярно проводить совместные учения и патрулирования на море и в воздухе. https://lenta.ru/news/2023/03/30/xi_preparing/?utm_source=yxnews&utm_medium=desktop","list(original = ""https://lenta.ru/news/2023/03/30/xi_preparing/?utm_source=yxnews&utm_medium=desktop"", expanded = ""https://lenta.ru/news/2023/03/30/xi_preparing/"")",NA,"https://www.facebook.com/100063641240437/posts/697470755717626","3966","-0.857142857142857","NULL","ru","0","19186835|697470755717626",NA,NA,NA,NA,"NA","1","0","0","0","0","0","0","0","0","0","2","1","1","0","1","1","1","0","0","0","19186835","Разоблачено","https://scontent-sea1-1.xx.fbcdn.net/v/t39.30808-1/215210705_1896608947154851_46986715262775492_n.png?stp=cp0_dst-png_p50x50&_nc_cat=101&ccb=1-7&_nc_sid=5f2048&_nc_ohc=4cDDjNxZWTgAX_iPzV6&_nc_ht=scontent-sea1-1.xx&oh=00_AfDEzs-95gm65rEChjhOCIf6tMZuYNA6jWYFpS9HHCxM1w&oe=6544B8F3","4145","https://www.facebook.com/965448856937536","Facebook","100063641240437","facebook_page","MEDIA_NEWS_COMPANY","FALSE","disclosed.live","RU","Канал независимых блогеров и журналистов.
Youtube.com/disclosed_","2018-05-01 18:02:43"
"53","503432503159171_2378694122299657","Facebook","2023-04-06 13:22:33","2023-04-10 07:30:09","link","Нейросеть ""Жириновский"". ","list(original = ""https://m.lenta.ru/news/2023/04/06/zirinivski_algoritm/"", expanded = ""https://m.lenta.ru/news/2023/04/06/zirinivski_algoritm/"")","https://m.lenta.ru/news/2023/04/06/zirinivski_algoritm/","https://www.facebook.com/groups/503432503159171/permalink/2378694122299657","53302","-2","list(type = ""photo"", url = ""https://www.facebook.com/"", height = 600, width = 600, full = ""https://scontent.xx.fbcdn.net/fb.png"")","ru","0","8436472|2378694122299657","В ЛДПР раскрыли подробности создания политического алгоритма «Жириновский»","lenta.ru","Пресс-секретарь ЛДПР Александр Дюпин раскрыл подробности создания политического алгоритма «Жириновский». В беседе с «Лентой.ру» он сообщил, что нейросеть будет с....",NA,"NA","1","0","3","0","0","17","0","0","0","0","8","2","4","3","3","18","1","3","0","1","8436472","ВАТА TV","https://scontent-sea1-1.xx.fbcdn.net/v/t31.18172-8/12039085_893303484052712_4816679014432361520_o.jpg?stp=c88.0.50.50a_cp0_dst-jpg_p50x50&_nc_cat=104&ccb=1-7&_nc_sid=f2fd11&_nc_ohc=dqWn07PTHgoAX-N0ZMk&_nc_ht=scontent-sea1-1.xx&oh=00_AfDU5vip_QimmzUSJHotCWBxowL3CsY7v-i721ItMXcnrQ&oe=656771FA","52906","https://www.facebook.com/groups/503432503159171","Facebook","503432503159171","facebook_group","none","FALSE",NA,NA,NA,NA
"54","349942938382545_6321607977882648","Facebook","2023-04-06 02:16:40","2023-04-07 23:37:20","link","Photo: RF IC Russia In the Tula region, a Wagner PMC fighter, who took part in the assault on Soledar, left a bag on a tree with a large sum of money and awards, including the Wagner Iron Black Cross. According to Lenta.ru, the bag was found by a nine-year-old boy, Timir Bakhtierov, who asked for help from passers-by to hand it over to the police.... https://www.easternherald.com/2023/04/06/a-participant-in-the-assault-on-soledar-a-soldier-of-the-armed-forces-of-the-russian-federation-forgot-200000-rubles-on-a-tree/","list(original = c(""https://www.easternherald.com/2023/04/06/a-participant-in-the-assault-on-soledar-a-soldier-of-the-armed-forces-of-the-russian-federation-forgot-200000-rubles-on-a-tree/"", ""https://www.easternherald.com/2023/04/06/a-participant-in-the-assault-on-soledar-a-soldier-of-the-armed-forces-of-the-russian-federation-forgot-200000-rubles-on-a-tree/""), expanded = c(""https://www.easternherald.com/2023/04/06/a-participant-in-the-assault-on-soledar-a-soldier-of-the-armed-forces-of-the-russian-federation-forgot-200000-rubles-on-a-tree/"", 
""https://www.easternherald.com/2023/04/06/a-participant-in-the-assault-on-soledar-a-soldier-of-the-armed-forces-of-the-russian-federation-forgot-200000-rubles-on-a-tree/""))","https://www.easternherald.com/2023/04/06/a-participant-in-the-assault-on-soledar-a-soldier-of-the-armed-forces-of-the-russian-federation-forgot-200000-rubles-on-a-tree/","https://www.facebook.com/349942938382545/posts/6321607977882648","5321","-34","list(type = ""photo"", url = ""https://external-sea1-1.xx.fbcdn.net/emg1/v/t13/4898928406796359501?url=https%3A%2F%2Fwww.easternherald.com%2Fwp-content%2Fuploads%2F2023%2F04%2FA-participant-in-the-assault-on-Soledar-a-soldier-of.jpg&fb_obo=1&utld=easternherald.com&stp=c0.5000x0.5000f_dst-emg0_p220x220_q75&ccb=13-1&oh=06_AbEyOcWotx7rDq5RipCdhFOqNfTVS5PStl5D-kGrn6efzg&oe=643018FF&_nc_sid=6ac203"", height = 220, width = 220, full = ""https://external-sea1-1.xx.fbcdn.net/emg1/v/t13/4898928406796359501?url=https%3A%2F%2Fwww.easternherald.com%2Fwp-content%2Fuploads%2F2023%2F04%2FA-participant-in-the-assault-on-Soledar-a-soldier-of.jpg&fb_obo=1&utld=easternherald.com&ccb=13-1&_nc_sid=834697&stp=dst-emg0_q75&ur=64c8fc&oh=06_AbGOfqf36d1p1wiuh6bknwq5m95ZDSdVpaFtvFIqKHIImg&oe=643018FF"")","en","0","10393904|6321607977882648","A participant in the assault on Soledar, a soldier of the Armed Forces of the Russian Federation forgot 200,000 rubles on a tree | The Eastern Herald","easternherald.com","Photo: RF IC Russia In the Tula region, a Wagner PMC fighter, who took part in the assault on Soledar, left a bag on a tree with a large sum of money and | The Eastern Herald",NA,"NA","0","0","0","0","0","0","0","0","0","0","2","2","1","2","2","2","3","3","0","1","10393904","The Eastern Herald","https://scontent-sea1-1.xx.fbcdn.net/v/t39.30808-1/285002006_5384946071548848_1330162646028690937_n.jpg?stp=cp0_dst-jpg_p50x50&_nc_cat=107&ccb=1-7&_nc_sid=5f2048&_nc_ohc=SDgGaZJJRrgAX_ZIQAU&_nc_ht=scontent-sea1-1.xx&oh=00_AfDAGRFuV3t43BJ3oklims2hgFsexXzapsngAMkMtVlOlg&oe=6544B6FA","5427","https://www.facebook.com/349942938382545","Facebook","100063822078885","facebook_page","TOPIC_NEWSPAPER","FALSE","EasternHeraldNEWS","AE","Challenging norms & reshaping global perspectives. Your go-to for insightful news and analysis.","2012-03-17 17:29:59"
