"","platformId","platform","date","updated","type","message","expandedLinks","link","postUrl","subscriberCount","score","media","languageCode","legacyId","id","title","caption","description","imageText","videoLengthMS","statistics.actual.likeCount","statistics.actual.shareCount","statistics.actual.commentCount","statistics.actual.loveCount","statistics.actual.wowCount","statistics.actual.hahaCount","statistics.actual.sadCount","statistics.actual.angryCount","statistics.actual.thankfulCount","statistics.actual.careCount","statistics.expected.likeCount","statistics.expected.shareCount","statistics.expected.commentCount","statistics.expected.loveCount","statistics.expected.wowCount","statistics.expected.hahaCount","statistics.expected.sadCount","statistics.expected.angryCount","statistics.expected.thankfulCount","statistics.expected.careCount","account.id","account.name","account.profileImage","account.subscriberCount","account.url","account.platform","account.platformId","account.accountType","account.pageCategory","account.verified","account.handle","account.pageAdminTopCountry","account.pageDescription","account.pageCreatedDate"
"1","199083020688675_1303399820256984","Facebook","2023-04-12 23:27:16","2023-04-14 23:40:06","photo","**Как российские военные будут уничтожать танки НАТО на Украине** «Наши лучшие противотанковые подразделения будут направлять туда, где предполагается использование самых современных танков противника». Такими словами военные эксперты комментируют заявления Минобороны о создании специальных групп по борьбе с бронетехникой стран НАТО, поставленной Украине. Как и с помощью какого оружия будут действовать эти группы? В российском Министерстве обороны сообщили о создании групп борьбы с западными танками. Отмечается, что соответствующая задача была поставлена по указанию заместителя министра обороны России генерал-полковника Юнус-Бека Евкурова. Начальник Центра боевой подготовки ВС России Евгений Арифулин в эфире программы «Военная приемка» телеканала «Звезда» рассказал, что в Главном управлении боевой подготовки разработаны методические рекомендации и организована методика их выполнения, а Центр боевой подготовки проводит и претворяет данные мероприятия в жизнь. Как отметил Арифулин, создание таких групп является большой государственной системной работой. В начале апреля генсек НАТО Йенс Столтенберг заявил о том, что первые танки Leopard и Challenger 2 уже на Украине. Агентство ТАСС подсчитало, что по данным на начало апреля Украина получила только 19% от всех обещанных Западом танков. Киеву передано 57 танков из 293 заявленных, причем 43 машины Leopard переданы Германией, Данией, Нидерландами, Польшей, Норвегией и Португалией, а 14 Challenger 2 отправила Великобритания. Анализируя преимущества и недостатки натовских танков, издание [Lenta.ru](https://l.facebook.com/l.php?u=https%3A%2F%2Fvk.com%2Faway.php%3Fto%3Dhttp%253A%252F%252FLenta.ru%26post%3D-167661899_1821400%26cc_key%26fbclid%3DIwAR0x2ijd1IudreSJvriJBSO3d8PwNJgUvRNd8WL6eFmpulQm3lf0pKl2YAU&h=AT3NXz3ofeOjwBlkEtfolb3t0PBCbrcnFrYF-TVEFSvR-zIq5g9SDT0NJPGt1iJfEhZha0HNSUZ0ixZGE-W29L1PQbE4ByrLuPgc0deINTR-DHwEra2DoE5LRi_xohcgCps&__tn__=-UK*F) отмечало, что американские M1A2 Abrams, британские Challenger 2 и немецкие Leopard 2 являются серьезными боевыми машинами. Они оснащены современными системами наблюдения и управления огнем, имеют внушительное бронирование, высокую мобильность и живучесть. Вместе с тем западные машины уже успели обзавестись не самой хорошей репутацией. Так, антирекламой Leopard послужило их применение Турцией в Сирии. Первые сообщения о потерях среди этих танков стали поступать буквально спустя несколько дней после начала их официального использования. В свою очередь, США за два года иракской войны потеряли более 80 своих танков Abrams. Кроме того, американские танки стоят дороже немецких аналогов, сложны в ремонте и обслуживании, а также потребляют много топлива. Что касается британских танков Challenger, то они существенно медленнее немецких и американских аналогов. Это еще и самый тяжелый танк НАТО, в зависимости от модификации его вес может достигать 75 тонн, что выдержит далеко не каждый мост. Военный обозреватель «Комсомольской правды» Виктор Баранец среди недостатков немецких танков Leopard называет их большой размер, что облегчает их обнаружение и поражение. Кроме того, «еще один недостаток – общее бронирование». «Наиболее уязвим корпус, а самое прочное место – левая часть лба башни», – рассуждает он. Среди недостатков Abrams Баранец отмечает борта со слабой броней, которые уязвимы даже для старых гранатометов. «А задняя часть танка – даже для пушек БМП», – указывает он. Рассуждая о характеристиках британских Challenger, Баранец указывает на невысокую надежность машины, неудобство работы экипажа и архаичную систему управления огнем. «Разновидностей и модификаций у танков, которые страны НАТО передают Украине, достаточно много. У них есть как традиционно уязвимые места – например, верх башни, моторное отделение или гусеницы, так и нюансы конкретных моделей. Все это сегодня находится в поле зрения наших специалистов, для того чтобы российская армия смогла дать уверенный отпор. Именно на этом, на мой взгляд, и основывалось решение о создании групп борьбы с западными танками», – говорит газете ВЗГЛЯД военный аналитик Михаил Онуфриенко. В ответ на решение стран – членов НАТО передать Украине свои танки российский ВПК готовится выпустить в текущем году полторы тысячи бронемашин и тем самым предъявить Западу мощный бронетанковый кулак. Увеличение производства отечественных танков важная, но не единственная задача ВС РФ в части противодействия танкам стран НАТО на Украине. Не менее важно усиливать работу противотанковых подразделений на основе сведений об уязвимостях и преимуществах западных машин. «Предполагаю, что в созданные в Минобороны группы борьбы с западными танками войдут самые оснащенные подразделения с наиболее современными типами противотанковых средств. Наши лучшие противотанковые подразделения будут направлять туда, где предполагается использование самых современных танков противника. Кроме того, их будут дополнительно обучать для борьбы с современными танками стран НАТО, с учетом их конструкций и тактики (truncated)","list(original = c(""https://l.facebook.com/l.php?u=https%3A%2F%2Fvk.com%2Faway.php%3Fto%3Dhttp%253A%252F%252FLenta.ru%26post%3D-167661899_1821400%26cc_key%26fbclid%3DIwAR0x2ijd1IudreSJvriJBSO3d8PwNJgUvRNd8WL6eFmpulQm3lf0pKl2YAU&h=AT3NXz3ofeOjwBlkEtfolb3t0PBCbrcnFrYF-TVEFSvR-zIq5g9SDT0NJPGt1iJfEhZha0HNSUZ0ixZGE-W29L1PQbE4ByrLuPgc0deINTR-DHwEra2DoE5LRi_xohcgCps&__tn__=-UK"", ""https://www.facebook.com/photo.php?fbid=1635250856938648&set=gm.1303399820256984&type=3""), expanded = c(""https://l.facebook.com/l.php?u=https%3A%2F%2Fvk.com%2Faway.php%3Fto%3Dhttp%253A%252F%252FLenta.ru%26post%3D-167661899_1821400%26cc_key%26fbclid%3DIwAR0x2ijd1IudreSJvriJBSO3d8PwNJgUvRNd8WL6eFmpulQm3lf0pKl2YAU&h=AT3NXz3ofeOjwBlkEtfolb3t0PBCbrcnFrYF-TVEFSvR-zIq5g9SDT0NJPGt1iJfEhZha0HNSUZ0ixZGE-W29L1PQbE4ByrLuPgc0deINTR-DHwEra2DoE5LRi_xohcgCps&__tn__=-UK"", 
""https://www.facebook.com/photo.php?fbid=1635250856938648&set=gm.1303399820256984&type=3""))","https://www.facebook.com/photo.php?fbid=1635250856938648&set=gm.1303399820256984&type=3","https://www.facebook.com/groups/199083020688675/permalink/1303399820256984","4585","-20","list(type = ""photo"", url = ""https://scontent-sea1-1.xx.fbcdn.net/v/t39.30808-6/336311962_936938450858050_3760925562944591180_n.jpg?_nc_cat=111&ccb=1-7&_nc_sid=5cd70e&_nc_ohc=IIe3bgTHVqIAX-NThWZ&_nc_ht=scontent-sea1-1.xx&oh=00_AfARrNm3Mjt1LtvAPFPLSalGEiK_os15Biw7Nm6lzDUffg&oe=643D0F7C"", height = 710, width = 1065, full = ""https://scontent-sea1-1.xx.fbcdn.net/v/t39.30808-6/336311962_936938450858050_3760925562944591180_n.jpg?_nc_cat=111&ccb=1-7&_nc_sid=5cd70e&_nc_ohc=IIe3bgTHVqIAX-NThWZ&_nc_ht=scontent-sea1-1.xx&oh=00_AfARrNm3Mjt1LtvAPFPLSalGEiK_os15Biw7Nm6lzDUffg&oe=643D0F7C"")","ru","0","8489338|1303399820256984",NA,NA,NA,NA,"NA","0","0","0","0","0","0","0","0","0","0","2","1","1","1","1","2","2","0","0","1","8489338","РОССИЯ. КРЕМЛЬ. ПУТИН.","https://scontent-sea1-1.xx.fbcdn.net/v/t39.30808-6/337263558_1276078746321632_2931126402649652707_n.jpg?stp=c13.0.50.50a_cp0_dst-jpg_p50x50&_nc_cat=100&ccb=1-7&_nc_sid=5f2048&_nc_ohc=eccxU3n2KxcAX_ZFD70&_nc_ht=scontent-sea1-1.xx&oh=00_AfDHstuL-WrhJKTn90GkB3KU5G5wbjQoZGn_zqsdmUXApw&oe=6544037D","4654","https://www.facebook.com/groups/199083020688675","Facebook","199083020688675","facebook_group","none","FALSE",NA,NA,NA,NA
"2","503432503159171_2382528171916252","Facebook","2023-04-12 17:39:34","2023-04-20 06:19:56","link","Время очешуительных историй: как ВСУ устроили геноцид российских свиней в трёхлетних трусиках!!!111 В смысле, свиньи были русскоговорящим, вооружёнными и в камуфляже? :) или","list(original = ""https://m.lenta.ru/news/2023/04/12/svinokonpleks/?utm_source=24smi&utm_medium=exchange&utm_term=28665&utm_content=4908100__1&utm_campaign=17734&es=24smi&utm_referrer=ex.24smi.info"", expanded = ""https://m.lenta.ru/news/2023/04/12/svinokonpleks/?utm_source=24smi&utm_medium=exchange&utm_term=28665&utm_content=4908100__1&utm_campaign=17734&es=24smi&utm_referrer=ex.24smi.info"")","https://m.lenta.ru/news/2023/04/12/svinokonpleks/?utm_source=24smi&utm_medium=exchange&utm_term=28665&utm_content=4908100__1&utm_campaign=17734&es=24smi&utm_referrer=ex.24smi.info","https://www.facebook.com/groups/503432503159171/permalink/2382528171916252","53290","-1.65384615384615","list(type = ""photo"", url = ""https://www.facebook.com/"", height = 600, width = 600, full = ""https://scontent.xx.fbcdn.net/fb.png"")","ru","0","8436472|2382528171916252","При атаке дрона на российский свинокомплекс погибли почти 200 свиней","lenta.ru","В Белгородской области в результате атаки дрона-камикадзе Вооруженных сил Украины (ВСУ) на свинокомплекс погибли 179 свиней. Об этом сообщает Telegram-канал SHOT. По данны....",NA,"NA","9","0","5","1","0","11","0","0","0","0","10","2","4","3","2","18","1","3","0","1","8436472","ВАТА TV","https://scontent-sea1-1.xx.fbcdn.net/v/t31.18172-8/12039085_893303484052712_4816679014432361520_o.jpg?stp=c88.0.50.50a_cp0_dst-jpg_p50x50&_nc_cat=104&ccb=1-7&_nc_sid=f2fd11&_nc_ohc=dqWn07PTHgoAX-N0ZMk&_nc_ht=scontent-sea1-1.xx&oh=00_AfDU5vip_QimmzUSJHotCWBxowL3CsY7v-i721ItMXcnrQ&oe=656771FA","52906","https://www.facebook.com/groups/503432503159171","Facebook","503432503159171","facebook_group","none","FALSE",NA,NA,NA,NA
"3","503432503159171_2382364638599272","Facebook","2023-04-12 11:28:59","2023-04-19 14:21:54","link","* Мы духовно богаты! - Не духовно, а душевно. И не богаты, а больны. ","list(original = ""https://lenta.ru/news/2023/04/11/tnv/"", expanded = ""https://lenta.ru/news/2023/04/11/tnv/"")","https://lenta.ru/news/2023/04/11/tnv/","https://www.facebook.com/groups/503432503159171/permalink/2382364638599272","53290","-2.15","list(type = ""photo"", url = ""https://www.facebook.com/"", height = 600, width = 600, full = ""https://scontent.xx.fbcdn.net/fb.png"")","ru","0","8436472|2382364638599272","Россиянин побывал в Таиланде и описал поездку фразой «все ради бабла»","lenta.ru","Российский путешественник побывал в Таиланде, оказался разочарован поездкой и описал ее фразой «все ради бабла». По его словам, в Паттайе он сходил на массаж, где п....",NA,"NA","5","0","0","0","0","15","0","0","0","0","10","2","4","3","2","18","1","3","0","1","8436472","ВАТА TV","https://scontent-sea1-1.xx.fbcdn.net/v/t31.18172-8/12039085_893303484052712_4816679014432361520_o.jpg?stp=c88.0.50.50a_cp0_dst-jpg_p50x50&_nc_cat=104&ccb=1-7&_nc_sid=f2fd11&_nc_ohc=dqWn07PTHgoAX-N0ZMk&_nc_ht=scontent-sea1-1.xx&oh=00_AfDU5vip_QimmzUSJHotCWBxowL3CsY7v-i721ItMXcnrQ&oe=656771FA","52906","https://www.facebook.com/groups/503432503159171","Facebook","503432503159171","facebook_group","none","FALSE",NA,NA,NA,NA
"4","100063641240437_701280552003313","Facebook","2023-04-12 11:00:54","2023-04-15 05:44:42","status","⚡️🤦‍♂ В Госдуме предложили наказывать граждан за жалобы в госорганы Депутат Госдумы Евгений Марков предложил наказывать россиян, злоупотребляющих правом на подачу жалобы в государственные органы. Об этом говорится в письме парламентария генеральному прокурору России Игорю Краснову. Документ поступил в редакцию ТАСС. В обоснование предложенной меры Марков указывает на большое количество обращений в госорганы, содержащих недостоверные сведения. https://lenta.ru/news/2023/04/11/deputat/ 👆🏻 У депутата Маркова одно предложение круче другого. Недавно этот народный избранник предлагал ""гуманный отстрел"" для решения проблемы бездомных животных. Потом, видимо, и жалующихся граждан предложит отстреливать, но исключительно гуманно. Вот бы еще кто предложил проводить психиатрическое освидетельствование депутатов Госдумы... Вот, кстати, страница этого депутата, можно написать ему свои предложения: https://vk.com/markovduma","list(original = c(""https://vk.com/markovduma"", ""https://lenta.ru/news/2023/04/11/deputat/""), expanded = c(""https://vk.com/id567076146"", ""https://lenta.ru/news/2023/04/11/deputat/""))",NA,"https://www.facebook.com/100063641240437/posts/701280552003313","3965","-12","NULL","ru","0","19186835|701280552003313",NA,NA,NA,NA,"NA","0","0","0","0","0","0","0","0","0","0","1","1","1","0","1","1","1","0","0","0","19186835","Разоблачено","https://scontent-sea1-1.xx.fbcdn.net/v/t39.30808-1/215210705_1896608947154851_46986715262775492_n.png?stp=cp0_dst-png_p50x50&_nc_cat=101&ccb=1-7&_nc_sid=5f2048&_nc_ohc=4cDDjNxZWTgAX_iPzV6&_nc_ht=scontent-sea1-1.xx&oh=00_AfDEzs-95gm65rEChjhOCIf6tMZuYNA6jWYFpS9HHCxM1w&oe=6544B8F3","4145","https://www.facebook.com/965448856937536","Facebook","100063641240437","facebook_page","MEDIA_NEWS_COMPANY","FALSE","disclosed.live","RU","Канал независимых блогеров и журналистов.
Youtube.com/disclosed_","2018-05-01 18:02:43"
